{
 "version": "1.0.0",
 "paper": {
  "path": "paper-heesch-certificates-v2.1-en.tex",
  "sha256": "4e4871d4976f10ac82ac1fd930a2a5abf9de6b2026f5ee118f8ded79d991af11",
  "bytes": 79189
 },
 "pdf": {
  "path": "paper-heesch-certificates-v2.1-en.pdf",
  "sha256": "9d9d0b7ad78991916cf4e6f0d5ce04ab7c0330bf7aac5e16465945c0a27c6dbc",
  "bytes": 175305
 },
 "kinds": {
  "lean-proof": "checked by the Lean kernel (and external kernels via Comparator); standard axioms only",
  "finite-computation": "checked by programs in this packet or recorded from finite computations; the programs are not formally verified",
  "independent-implementation": "agreement of separately written implementations",
  "prose": "argued in the article, not formalized"
 },
 "scope": {
  "human_expert_review": false,
  "lean_internal_unsat_proofs": false,
  "lrat_or_verified_checker": false,
  "off_grid_placements": false,
  "exhaustive_beyond_listed_inputs": false,
  "counting_formally_verified": false,
  "inputs_redistributed": false,
  "priority_claimed": false
 },
 "not_claimed": [
  "Heesch values for shapes outside the listed selection (Table 3)",
  "that Kaplan's files contain every non-tiler of each size (taken from his enumeration)",
  "placements off the fixed grid",
  "Lean-internal UNSAT proofs, LRAT, or a proof of the file comparison",
  "formally verified counting; proof certificates for the outer completion counts",
  "the 15-hex #315 totals from two implementations",
  "that no polyomino has finite Hh = 4",
  "priority for counting coronas or for certifying Heesch numbers",
  "human expert review"
 ],
 "claims": [
  {
   "id": "encoding-soundness",
   "paper_label": "thm:sound",
   "kind": "lean-proof",
   "statement": "For the square, hexagonal and triangular grids, every finite S, K >= 1, every permutation order of the at-most-one counter inputs and every list of hole blocks valid for level K-1 (resp. K): if cnfOrd G ord S K blocks is unsatisfiable, S has no Hh-corona (resp. Hc-corona) with K layers.",
   "lean": {
    "statement_file": "formal/Heesch/Challenge.lean",
    "solution_module": "Heesch.Solution",
    "declarations": [
     "Heesch.hh_sound_square",
     "Heesch.hc_sound_square",
     "Heesch.hh_sound_hex",
     "Heesch.hc_sound_hex",
     "Heesch.hh_sound_tri",
     "Heesch.hc_sound_tri"
    ],
    "axioms": [
     "propext",
     "Classical.choice",
     "Quot.sound"
    ],
    "kernel_runs": "Comparator --paranoid: Lean kernel (paranoid and default), lean4lean, nanoda, con-leche, con-ron; six runs, five implementations",
    "statement_reading": "independent AI reading against the specification and Kaplan's definitions: faithful with caveats (not a human review)"
   },
   "evidence": [
    {
     "path": "formal/Heesch/Challenge.lean",
     "sha256": "3a637f3260f784d00f7a332eb10351563bd4605b2e03458836b8a67781780d73",
     "bytes": 28045
    },
    {
     "path": "formal/Heesch/Solution.lean",
     "sha256": "6815e14f3ab821a4745c36ef9fe3957735382217610ed69bd9b2eb394e01dc17",
     "bytes": 3886
    },
    {
     "path": "formal/comparator.json",
     "sha256": "4384decb389cc29850dc0912c1d7c804969c14b6f23c8ed50d5ada201f77ca3b",
     "bytes": 389
    },
    {
     "path": "ci/Axioms.lean",
     "sha256": "46df3258d571dea6038855081c12b844fb66369243e1c250f9090c958f06c772",
     "bytes": 448
    },
    {
     "path": "evidence/comparator-2026-10-22.txt",
     "sha256": "45a00af03d145fb53865cb0df54ab049eb2a2990b24acbccfd7088a3ea4375b4",
     "bytes": 16079
    },
    {
     "path": "evidence/comparator-public-names-2026-10-23.txt",
     "sha256": "9ef58070bd01e50b667f17f15b0eb2f728df1964d44372626e9f16aeb66bfbc4",
     "bytes": 15204
    }
   ],
   "reproduce": "CI job 'lean' (lake build, ci/Axioms.lean, lake comparator --paranoid)",
   "qualification": "statement accepts any finite set of points as S; copies on the fixed grid; the link between a DIMACS file and cnfOrd is outside the statement"
  },
  {
   "id": "square-instance-equals-earlier-definition",
   "paper_label": "sec:lean",
   "kind": "lean-proof",
   "statement": "cnfOrd squareGrid ord S K blocks equals the earlier square-only cnfOrd for all arguments.",
   "lean": {
    "statement_file": "formal/Heesch/SquareEq.lean",
    "declarations": [
     "HeeschProof.cnfOrd_square"
    ],
    "axioms": [
     "propext",
     "Classical.choice",
     "Quot.sound"
    ],
    "kernel_runs": "Lean kernel (lake build); outside the Comparator statement"
   },
   "evidence": [
    {
     "path": "formal/Heesch/SquareEq.lean",
     "sha256": "e02d583b02fdf619e25403238b79ec7962d4b8b2146bb618ff89bf64bb26db78",
     "bytes": 4210
    },
    {
     "path": "ci/Axioms.lean",
     "sha256": "46df3258d571dea6038855081c12b844fb66369243e1c250f9090c958f06c772",
     "bytes": 448
    }
   ],
   "reproduce": "CI job 'lean'"
  },
  {
   "id": "lower-bounds",
   "paper_label": "sec:certificates",
   "kind": "finite-computation",
   "statement": "6,574 corona witnesses for the 3,964 selected shapes (Table 3) satisfy (P0)-(P3), congruence and the disc conditions for the claimed Hc and Hh; two separately written geometric checkers accept all.",
   "evidence": [
    {
     "path": "witnesses/hex/06hex_0up.jsonl",
     "sha256": "faa0fca589ecb7c84eea934ec096a7acd2fea073b5876e1f8fb1eff4a5f48f46",
     "bytes": 5291
    },
    {
     "path": "witnesses/hex/07hex_0up.jsonl",
     "sha256": "897f7dd0cfc1d98662b82857046cde6b11cc2aeab05eeb832fcf2ad43dda10c7",
     "bytes": 55753
    },
    {
     "path": "witnesses/hex/08hex_0up.jsonl",
     "sha256": "8ce02f0921c16dfd6e8845c12802a70acca8b2570049215f770de9dd24a7f121",
     "bytes": 528458
    },
    {
     "path": "witnesses/hex/10hex_2up.jsonl",
     "sha256": "549f0294ddb79b5c80a8e94d928bc0536effa77b32489043f99ce72825a8b595",
     "bytes": 8427
    },
    {
     "path": "witnesses/hex/11hex_3up.jsonl",
     "sha256": "426387fdd8e1a9d4cbf8248cf9837c1c9cd6d178a0d003bffc175b5709c13392",
     "bytes": 56549
    },
    {
     "path": "witnesses/hex/12hex_3up.jsonl",
     "sha256": "80cdd8462f6145c1a2d8f8a6501f6cebf1a939b5d6d7df72632464968cff1145",
     "bytes": 19083
    },
    {
     "path": "witnesses/hex/13hex_3up.jsonl",
     "sha256": "4895eb83fbd4267850413aa5e3cc49afcb52998e5488bf86c1944f62eb9758e7",
     "bytes": 25808
    },
    {
     "path": "witnesses/hex/15hex_3up.jsonl",
     "sha256": "e9447a82e76cc8878d92893f77d4512222d914e0fc5dd101676008a73b607dcb",
     "bytes": 33766
    },
    {
     "path": "witnesses/hex/16hex_3up.jsonl",
     "sha256": "b31c45cd599c44e0bc6f7e22564d9e45b5c054265bca028e954dbd8a1b76a683",
     "bytes": 22107
    },
    {
     "path": "witnesses/iamond/07iamond_0up.jsonl",
     "sha256": "54365f4f62819b0668827a354fd78bd4d51ffb87a1306cc3dc4ca47d74ae5100",
     "bytes": 590
    },
    {
     "path": "witnesses/iamond/09iamond_0up.jsonl",
     "sha256": "0f812fe9c6af15a1a6303b16abdc2552243371a858ce7086747da2102acfabe7",
     "bytes": 13558
    },
    {
     "path": "witnesses/iamond/10iamond_0up.jsonl",
     "sha256": "8719ee56f879e9d9164ba42747773d5974c7a6fbdc9344d0b96090e7bc6c5b14",
     "bytes": 119843
    },
    {
     "path": "witnesses/iamond/11iamond_0up.jsonl",
     "sha256": "61eaa38574b272331f5128cf059145167d06d748891f052e2a0a3573d20d6f46",
     "bytes": 758200
    },
    {
     "path": "witnesses/iamond/12iamond_0up.jsonl",
     "sha256": "f828e250cbb94dbb183980a0cf0665c903fe4260accf51968f4c0824c0ff678b",
     "bytes": 1148647
    },
    {
     "path": "witnesses/iamond/20iamond_2up.jsonl",
     "sha256": "c99504e4ab28cee23e341b568831537db0203266bbdca30e6e0db75d92fd9812",
     "bytes": 23690
    },
    {
     "path": "witnesses/omino/07omino_0up.jsonl",
     "sha256": "f9895473cc6af875cdcac48d03d17167b92927aeb33b8cdf90fdb1affe68cef0",
     "bytes": 2753
    },
    {
     "path": "witnesses/omino/08omino_0up.jsonl",
     "sha256": "4363cc0e922eedd37e044112b90ff88cc04270c78d5996a44a7e6417527e865f",
     "bytes": 20435
    },
    {
     "path": "witnesses/omino/09omino_0up.jsonl",
     "sha256": "533b124c993c9512630cec47182436cca09518a16834d10976af3f4c10e37cfc",
     "bytes": 191346
    },
    {
     "path": "witnesses/omino/10omino_0up.jsonl",
     "sha256": "0826fd342b39951e7cf740743198c1490d4a7d2bfb84b51d9bfcc8efa24ddab1",
     "bytes": 1319753
    },
    {
     "path": "witnesses/omino/11omino_2up.jsonl",
     "sha256": "b213db5ef18bc0ccde3a12661d47c7072e470415c97b59f5080dcf9a4b17f959",
     "bytes": 5026
    },
    {
     "path": "witnesses/omino/13omino_2up.jsonl",
     "sha256": "b527ab279d79b6ab8b312c95b9a8822986e35fe108d6b4241951f343ec0d01a8",
     "bytes": 6915
    },
    {
     "path": "witnesses/omino/17omino_2up.jsonl",
     "sha256": "7b2637b6ffe01e09bf4936d85eb69bec9571b09437553995191bbde000fd8e18",
     "bytes": 22580
    },
    {
     "path": "checkers/check_witness.py",
     "sha256": "851fb6b64650f095d300468a9fb76033592e388f6fe0bcbbef0dd9cd7b90232e",
     "bytes": 10024
    },
    {
     "path": "checkers/geometry.py",
     "sha256": "35ec16f548a303e77ccc564ede6b06eb7df52f17352ea98c1b94423c6f900ddc",
     "bytes": 8821
    },
    {
     "path": "checkers/check_all_witnesses.py",
     "sha256": "f6cecda454d181c38039cfe9f85add37c3b1cdd658d946041928a5f3eb54a54a",
     "bytes": 3295
    }
   ],
   "reproduce": "python3 -B checkers/check_all_witnesses.py (seconds); part of ci_check.py",
   "numbers": {
    "shapes": 3964,
    "witnesses": 6574,
    "combined": 1354
   }
  },
  {
   "id": "upper-bounds",
   "paper_label": "sec:certificates",
   "kind": "finite-computation",
   "statement": "For every selected shape, the CNF for K = Hh+1 (mode Hh, no blocks) and, if Hc < Hh, for K = Hc+1 (mode Hc, with hole blocks) is unsatisfiable: 5,019 DRAT/DRUP proofs accepted by drat-trim.",
   "evidence": [
    {
     "path": "certificates/hex/06hex_0up.jsonl",
     "sha256": "633c09e16a5193a5cb5c3e2c61abd250e260ca40dad8a65709268d41c670e95f",
     "bytes": 2671
    },
    {